{"$id":"host-runtime-package-v1.schema.json","$schema":"https://json-schema.org/draft/2020-12/schema","additionalProperties":false,"properties":{"authoritative":{"const":false},"backend_reference":{"additionalProperties":false,"properties":{"backend_id":{"pattern":"^schuss-backend-[0-9]{6}$","type":"string"},"content_hash":{"pattern":"^sha256:[0-9a-f]{64}$","type":"string"},"revision":{"minimum":1,"type":"integer"}},"required":["backend_id","revision","content_hash"],"type":"object"},"block_policy":{"const":"bounded-variable-with-final-partial"},"canonical_profile":{"const":"schuss-canonical-json-v1"},"compute_target_reference":{"additionalProperties":false,"properties":{"compute_target_id":{"pattern":"^schuss-compute-target-[0-9]{6}$","type":"string"},"content_hash":{"pattern":"^sha256:[0-9a-f]{64}$","type":"string"},"revision":{"minimum":1,"type":"integer"}},"required":["compute_target_id","revision","content_hash"],"type":"object"},"connections":{"items":{"additionalProperties":false,"properties":{"buffer_index":{"maximum":127,"minimum":0,"type":"integer"},"connection_id":{"pattern":"^graph-connection-[0-9]{6}$","type":"string"},"destination":{"additionalProperties":false,"properties":{"facet_id":{"pattern":"^component-port-[0-9]{6}$","type":"string"},"node_id":{"pattern":"^graph-node-[0-9]{6}$","type":"string"}},"required":["node_id","facet_id"],"type":"object"},"source":{"additionalProperties":false,"properties":{"facet_id":{"pattern":"^component-port-[0-9]{6}$","type":"string"},"node_id":{"pattern":"^graph-node-[0-9]{6}$","type":"string"}},"required":["node_id","facet_id"],"type":"object"}},"required":["connection_id","source","destination","buffer_index"],"type":"object"},"maxItems":192,"minItems":1,"type":"array","uniqueItems":true,"x-schuss-array-kind":"set"},"content_hash":{"pattern":"^sha256:[0-9a-f]{64}$","type":"string"},"control_period_frames":{"const":16},"derived":{"const":true},"engine_protocol_abi":{"const":"schuss-audio-engine-protocol-v1"},"event_contract":{"additionalProperties":false,"properties":{"accepted_kinds":{"items":{"enum":["midi-message","parameter-q27"]},"maxItems":2,"minItems":2,"type":"array","uniqueItems":true,"x-schuss-array-kind":"set"},"capacity":{"const":1024},"ordering":{"const":"frame-offset-then-sequence"},"overflow_policy":{"const":"drop-newest-and-count"}},"required":["capacity","ordering","accepted_kinds","overflow_policy"],"type":"object"},"exclusions":{"items":{"minLength":1,"type":"string"},"minItems":1,"type":"array","uniqueItems":true,"x-schuss-array-kind":"set"},"factory_registry_version":{"const":"schuss-rt-factory-registry-v1"},"graph_reference":{"additionalProperties":false,"properties":{"content_hash":{"pattern":"^sha256:[0-9a-f]{64}$","type":"string"},"graph_id":{"pattern":"^schuss-graph-[0-9]{6}$","type":"string"},"revision":{"minimum":1,"type":"integer"}},"required":["graph_id","revision","content_hash"],"type":"object"},"host_build_request_reference":{"additionalProperties":false,"properties":{"build_request_id":{"pattern":"^schuss-build-request-[0-9]{6}$","type":"string"},"content_hash":{"pattern":"^sha256:[0-9a-f]{64}$","type":"string"},"revision":{"minimum":1,"type":"integer"}},"required":["build_request_id","revision","content_hash"],"type":"object"},"input_channels":{"const":0},"instrument_reference":{"additionalProperties":false,"properties":{"content_hash":{"pattern":"^sha256:[0-9a-f]{64}$","type":"string"},"instrument_id":{"pattern":"^schuss-instrument-[0-9]{6}$","type":"string"},"revision":{"minimum":1,"type":"integer"}},"required":["instrument_id","revision","content_hash"],"type":"object"},"latency_frames":{"const":0},"limits":{"additionalProperties":false,"properties":{"buffer_count":{"const":128},"connection_count":{"const":192},"event_count":{"const":1024},"node_count":{"const":64},"parameter_count":{"const":256},"schedule_length":{"const":64},"state_bytes":{"const":65536}},"required":["node_count","connection_count","buffer_count","state_bytes","parameter_count","event_count","schedule_length"],"type":"object"},"max_block_frames":{"const":512},"memory_plan":{"additionalProperties":false,"properties":{"buffer_bytes":{"maximum":262144,"minimum":2048,"type":"integer"},"buffer_count":{"maximum":128,"minimum":1,"type":"integer"},"buffer_frames":{"const":512},"event_capacity":{"const":1024},"parameter_count":{"maximum":256,"minimum":0,"type":"integer"},"state_alignment_bytes":{"const":16},"state_bytes":{"maximum":65536,"minimum":1,"type":"integer"}},"required":["state_bytes","state_alignment_bytes","buffer_count","buffer_frames","buffer_bytes","parameter_count","event_capacity"],"type":"object"},"nodes":{"items":{"additionalProperties":false,"properties":{"binding_reference":{"additionalProperties":false,"properties":{"content_hash":{"pattern":"^sha256:[0-9a-f]{64}$","type":"string"},"implementation_id":{"pattern":"^schuss-implementation-[0-9]{6}$","type":"string"},"revision":{"minimum":1,"type":"integer"}},"required":["implementation_id","revision","content_hash"],"type":"object"},"contract_reference":{"additionalProperties":false,"properties":{"component_contract_id":{"pattern":"^schuss-component-contract-[0-9]{6}$","type":"string"},"content_hash":{"pattern":"^sha256:[0-9a-f]{64}$","type":"string"},"revision":{"minimum":1,"type":"integer"}},"required":["component_contract_id","revision","content_hash"],"type":"object"},"factory_id":{"enum":["schuss.rt.crossfade-q27-v0","schuss.rt.output-q27-v0","schuss.rt.pwm-q27-v0","schuss.rt.saw-q27-v0","schuss.rt.smooth-q27-v0","schuss.rt.soft-q27-v0","schuss.rt.vca-q27-v0"]},"inputs":{"items":{"oneOf":[{"additionalProperties":false,"properties":{"buffer_index":{"maximum":127,"minimum":0,"type":"integer"},"facet_id":{"pattern":"^component-port-[0-9]{6}$","type":"string"},"source_kind":{"const":"buffer"}},"required":["facet_id","source_kind","buffer_index"],"type":"object"},{"additionalProperties":false,"properties":{"facet_id":{"pattern":"^component-port-[0-9]{6}$","type":"string"},"fractional_bits":{"maximum":30,"minimum":0,"type":"integer"},"source_kind":{"const":"constant"},"value_q":{"maximum":2147483647,"minimum":-2147483648,"type":"integer"}},"required":["facet_id","source_kind","value_q","fractional_bits"],"type":"object"}]},"maxItems":3,"type":"array","x-schuss-array-kind":"sequence"},"node_id":{"pattern":"^graph-node-[0-9]{6}$","type":"string"},"outputs":{"items":{"additionalProperties":false,"properties":{"buffer_index":{"maximum":127,"minimum":0,"type":"integer"},"facet_id":{"pattern":"^component-port-[0-9]{6}$","type":"string"}},"required":["facet_id","buffer_index"],"type":"object"},"maxItems":2,"type":"array","x-schuss-array-kind":"sequence"},"parameters":{"items":{"additionalProperties":false,"properties":{"facet_id":{"pattern":"^component-parameter-[0-9]{6}$","type":"string"},"value_q":{"maximum":2147483647,"minimum":-2147483648,"type":"integer"}},"required":["facet_id","value_q"],"type":"object"},"maxItems":4,"type":"array","uniqueItems":true,"x-schuss-array-kind":"set"},"role":{"enum":["crossfade","output","pwm","saw","smooth","soft","vca"]},"state_alignment_bytes":{"enum":[1,4,8,16]},"state_offset_bytes":{"minimum":0,"type":"integer"},"state_size_bytes":{"maximum":4096,"minimum":0,"type":"integer"}},"required":["node_id","role","contract_reference","binding_reference","factory_id","inputs","outputs","parameters","state_offset_bytes","state_size_bytes","state_alignment_bytes"],"type":"object"},"maxItems":64,"minItems":2,"type":"array","x-schuss-array-kind":"sequence"},"numeric_profile":{"const":"schuss-host-q27-reference-v0"},"output_channels":{"const":2},"outputs":{"additionalProperties":false,"properties":{"left_buffer":{"maximum":127,"minimum":0,"type":"integer"},"node_id":{"pattern":"^graph-node-[0-9]{6}$","type":"string"},"right_buffer":{"maximum":127,"minimum":0,"type":"integer"}},"required":["node_id","left_buffer","right_buffer"],"type":"object"},"project_reference":{"additionalProperties":false,"properties":{"content_hash":{"pattern":"^sha256:[0-9a-f]{64}$","type":"string"},"project_id":{"pattern":"^schuss-project-[0-9]{6}$","type":"string"},"revision":{"minimum":1,"type":"integer"}},"required":["project_id","revision","content_hash"],"type":"object"},"runtime_abi":{"const":"schuss-rt-abi-v1"},"sample_rate_hz":{"const":48000},"schedule":{"items":{"pattern":"^graph-node-[0-9]{6}$","type":"string"},"maxItems":64,"minItems":2,"type":"array","uniqueItems":true,"x-schuss-array-kind":"sequence"},"schema_version":{"const":"host-runtime-package-v1"},"seed":{"maximum":4294967295,"minimum":0,"type":"integer"},"source_plan_sha256":{"pattern":"^[0-9a-f]{64}$","type":"string"},"tail_frames":{"const":0}},"required":["schema_version","canonical_profile","derived","authoritative","content_hash","runtime_abi","engine_protocol_abi","factory_registry_version","numeric_profile","project_reference","graph_reference","instrument_reference","host_build_request_reference","compute_target_reference","backend_reference","source_plan_sha256","sample_rate_hz","max_block_frames","control_period_frames","block_policy","input_channels","output_channels","latency_frames","tail_frames","seed","limits","memory_plan","nodes","connections","schedule","outputs","event_contract","exclusions"],"title":"Schuss bounded variable host runtime package v1","type":"object"}
