{"authoritative":false,"backend_reference":{"backend_id":"schuss-backend-000003","content_hash":"sha256:c188a702201625cbf32d49976ce54a06194dea89d3815e972e319f4b6199a116","revision":1},"block_policy":"bounded-variable-with-final-partial","canonical_profile":"schuss-canonical-json-v1","compute_target_reference":{"compute_target_id":"schuss-compute-target-000002","content_hash":"sha256:8e66c6e40db0215c69c44852f6838a289342f372379262b87acc4a2bb49bd290","revision":1},"connections":[{"buffer_index":0,"connection_id":"graph-connection-000001","destination":{"facet_id":"component-port-000001","node_id":"graph-node-000003"},"source":{"facet_id":"component-port-000002","node_id":"graph-node-000001"}},{"buffer_index":0,"connection_id":"graph-connection-000006","destination":{"facet_id":"component-port-000001","node_id":"graph-node-000007"},"source":{"facet_id":"component-port-000002","node_id":"graph-node-000005"}},{"buffer_index":1,"connection_id":"graph-connection-000002","destination":{"facet_id":"component-port-000001","node_id":"graph-node-000006"},"source":{"facet_id":"component-port-000003","node_id":"graph-node-000002"}},{"buffer_index":1,"connection_id":"graph-connection-000008","destination":{"facet_id":"component-port-000001","node_id":"graph-node-000008"},"source":{"facet_id":"component-port-000003","node_id":"graph-node-000007"}},{"buffer_index":1,"connection_id":"graph-connection-000009","destination":{"facet_id":"component-port-000002","node_id":"graph-node-000008"},"source":{"facet_id":"component-port-000003","node_id":"graph-node-000007"}},{"buffer_index":2,"connection_id":"graph-connection-000005","destination":{"facet_id":"component-port-000002","node_id":"graph-node-000006"},"source":{"facet_id":"component-port-000002","node_id":"graph-node-000003"}},{"buffer_index":3,"connection_id":"graph-connection-000007","destination":{"facet_id":"component-port-000002","node_id":"graph-node-000007"},"source":{"facet_id":"component-port-000004","node_id":"graph-node-000006"}}],"content_hash":"sha256:a8ce039db0d1b1edaecd9f664a759c3ab275dc75c1bbe72b74bc9e1f397b4f42","control_period_frames":16,"derived":true,"engine_protocol_abi":"schuss-audio-engine-protocol-v1","event_contract":{"accepted_kinds":["midi-message","parameter-q27"],"capacity":1024,"ordering":"frame-offset-then-sequence","overflow_policy":"drop-newest-and-count"},"exclusions":["JUCE dependency in schuss_rt","Ksoloti equivalence claim","cycles and implicit delay","dynamic graph mutation on callback","implicit stream conversion","state migration during replacement","unsupported factories outside Task 031 seven"],"factory_registry_version":"schuss-rt-factory-registry-v1","graph_reference":{"content_hash":"sha256:0431ce3c72f51ef74755e18b1c789f0081326b41f7c167b92630a7a2246ce0f7","graph_id":"schuss-graph-508458","revision":1},"host_build_request_reference":{"build_request_id":"schuss-build-request-413229","content_hash":"sha256:6f7b22609e53796c78c4861c0bbccfed16890201ac7e777960b3ad48a5b630d3","revision":1},"input_channels":0,"instrument_reference":{"content_hash":"sha256:c50d7675ae509af58d028b69d1bc6bf6a85d133111a4f911d12a31fefa6a8ee1","instrument_id":"schuss-instrument-289694","revision":1},"latency_frames":0,"limits":{"buffer_count":128,"connection_count":192,"event_count":1024,"node_count":64,"parameter_count":256,"schedule_length":64,"state_bytes":65536},"max_block_frames":512,"memory_plan":{"buffer_bytes":8192,"buffer_count":4,"buffer_frames":512,"event_capacity":1024,"parameter_count":3,"state_alignment_bytes":16,"state_bytes":48},"nodes":[{"binding_reference":{"content_hash":"sha256:e928bf31a0b4427d6c960d4a0d29b181912aa20635ff244673d784e3f66a413f","implementation_id":"schuss-implementation-000162","revision":2},"contract_reference":{"component_contract_id":"schuss-component-contract-000012","content_hash":"sha256:3f399547dbe7a1a76bdcedc1d1d886ccd49d0620fdbca3fbace6aac0a9d2292c","revision":1},"factory_id":"schuss.rt.saw-q27-v0","inputs":[{"facet_id":"component-port-000001","fractional_bits":21,"source_kind":"constant","value_q":0}],"node_id":"graph-node-000001","outputs":[{"buffer_index":0,"facet_id":"component-port-000002"}],"parameters":[{"facet_id":"component-parameter-000001","value_q":-50331648}],"role":"saw","state_alignment_bytes":16,"state_offset_bytes":0,"state_size_bytes":16},{"binding_reference":{"content_hash":"sha256:f4a9f8f06aaf286860dc31e3bf4faf1b60b786e925a307a1e3641bc576601df2","implementation_id":"schuss-implementation-000163","revision":2},"contract_reference":{"component_contract_id":"schuss-component-contract-000013","content_hash":"sha256:2c4d15d5228dadfbf9c5ecb8734e7207b7157fc8960fb4100b461b59f859daa0","revision":1},"factory_id":"schuss.rt.pwm-q27-v0","inputs":[{"facet_id":"component-port-000001","fractional_bits":21,"source_kind":"constant","value_q":0},{"facet_id":"component-port-000002","fractional_bits":27,"source_kind":"constant","value_q":0}],"node_id":"graph-node-000002","outputs":[{"buffer_index":1,"facet_id":"component-port-000003"}],"parameters":[{"facet_id":"component-parameter-000001","value_q":-25165824}],"role":"pwm","state_alignment_bytes":16,"state_offset_bytes":16,"state_size_bytes":16},{"binding_reference":{"content_hash":"sha256:5444c071225361d2cff4542406fc17d4ecbfd7396884285d1a776f7c51bde7be","implementation_id":"schuss-implementation-000164","revision":2},"contract_reference":{"component_contract_id":"schuss-component-contract-000016","content_hash":"sha256:c98e44b172cf256439edfe2f51c15499f29ffe39900d9f8de72c339e346762e2","revision":1},"factory_id":"schuss.rt.soft-q27-v0","inputs":[{"buffer_index":0,"facet_id":"component-port-000001","source_kind":"buffer"}],"node_id":"graph-node-000003","outputs":[{"buffer_index":2,"facet_id":"component-port-000002"}],"parameters":[],"role":"soft","state_alignment_bytes":1,"state_offset_bytes":32,"state_size_bytes":0},{"binding_reference":{"content_hash":"sha256:ba3859246c68f72a9c4c14ad8ccdbbac4273bcccb69f85eb1ffb100ec0db5a83","implementation_id":"schuss-implementation-000165","revision":2},"contract_reference":{"component_contract_id":"schuss-component-contract-000015","content_hash":"sha256:705b8e11c00d985eb8fd010a2d3fd71cb891f00711ad647b0746cdfb90c6ff81","revision":1},"factory_id":"schuss.rt.smooth-q27-v0","inputs":[{"facet_id":"component-port-000001","fractional_bits":27,"source_kind":"constant","value_q":67108864}],"node_id":"graph-node-000005","outputs":[{"buffer_index":0,"facet_id":"component-port-000002"}],"parameters":[{"facet_id":"component-parameter-000001","value_q":0}],"role":"smooth","state_alignment_bytes":8,"state_offset_bytes":32,"state_size_bytes":8},{"binding_reference":{"content_hash":"sha256:31c327556140c1dc8fed576ffcaa456d0987921cf274f0b8f04e180a2c7be597","implementation_id":"schuss-implementation-000166","revision":2},"contract_reference":{"component_contract_id":"schuss-component-contract-000003","content_hash":"sha256:96a29faf58769be5f2ac52de07aa80cae3dcdff28f0f3c158fb1fd12cc234a8d","revision":1},"factory_id":"schuss.rt.crossfade-q27-v0","inputs":[{"buffer_index":1,"facet_id":"component-port-000001","source_kind":"buffer"},{"buffer_index":2,"facet_id":"component-port-000002","source_kind":"buffer"},{"facet_id":"component-port-000003","fractional_bits":27,"source_kind":"constant","value_q":67108864}],"node_id":"graph-node-000006","outputs":[{"buffer_index":3,"facet_id":"component-port-000004"}],"parameters":[],"role":"crossfade","state_alignment_bytes":1,"state_offset_bytes":40,"state_size_bytes":0},{"binding_reference":{"content_hash":"sha256:c05655fe1840bea79d9b6bf03e27231cea440ccde23f2ee7b75e5c5216893c28","implementation_id":"schuss-implementation-000167","revision":2},"contract_reference":{"component_contract_id":"schuss-component-contract-000020","content_hash":"sha256:0cf9737582327560e82feb565fd3092993b750938a9669fc43305b5658ac5490","revision":1},"factory_id":"schuss.rt.vca-q27-v0","inputs":[{"buffer_index":0,"facet_id":"component-port-000001","source_kind":"buffer"},{"buffer_index":3,"facet_id":"component-port-000002","source_kind":"buffer"}],"node_id":"graph-node-000007","outputs":[{"buffer_index":1,"facet_id":"component-port-000003"}],"parameters":[],"role":"vca","state_alignment_bytes":8,"state_offset_bytes":40,"state_size_bytes":8},{"binding_reference":{"content_hash":"sha256:6dda7b4532e2e1798c0f1d7bcf67d74846f7e407456ecc3aaba57b24948af33f","implementation_id":"schuss-implementation-000168","revision":2},"contract_reference":{"component_contract_id":"schuss-component-contract-000009","content_hash":"sha256:179c1526ed2bd6d9ad1c6fbfc9caa7abc21f479bef50cf93c8599b5817ca8718","revision":1},"factory_id":"schuss.rt.output-q27-v0","inputs":[{"buffer_index":1,"facet_id":"component-port-000001","source_kind":"buffer"},{"buffer_index":1,"facet_id":"component-port-000002","source_kind":"buffer"}],"node_id":"graph-node-000008","outputs":[],"parameters":[],"role":"output","state_alignment_bytes":1,"state_offset_bytes":48,"state_size_bytes":0}],"numeric_profile":"schuss-host-q27-reference-v0","output_channels":2,"outputs":{"left_buffer":1,"node_id":"graph-node-000008","right_buffer":1},"project_reference":{"content_hash":"sha256:933f132b29614ed9843fc090852816f02308e46c722da9f802819ca2ea74c46b","project_id":"schuss-project-000033","revision":1},"runtime_abi":"schuss-rt-abi-v1","sample_rate_hz":48000,"schedule":["graph-node-000001","graph-node-000002","graph-node-000003","graph-node-000005","graph-node-000006","graph-node-000007","graph-node-000008"],"schema_version":"host-runtime-package-v1","seed":0,"source_plan_sha256":"9b86bd44679a3e543f74d4cf773341c3518d12ead074cb69211e8311e1ac9c2d","tail_frames":0}
